{
  "schema_version": "1.0.0",
  "generated_at": "2026-05-17T02:15:00Z",
  "accepted": true,
  "run_id": "reopt_2026-05-17T02-15-00Z_000001",
  "status": "QUEUED",
  "trigger_source": "MANUAL_API",
  "requested_timeframes": ["1m", "15m", "1h"],
  "request_fingerprint": null,
  "service_version": null,
  "queued_at": "2026-05-17T02:15:00Z",
  "status_route": "/v1/strategy/reoptimize/runs/reopt_2026-05-17T02-15-00Z_000001",
  "cancel_route": "/v1/strategy/reoptimize/runs/reopt_2026-05-17T02-15-00Z_000001/cancel",
  "active_run_id": null,
  "operator_action_required": false,
  "progress": {
    "phase": "QUEUED",
    "requested_timeframes": ["1m", "15m", "1h"],
    "active_timeframe": null,
    "planned_timeframe_count": 3,
    "completed_timeframe_count": 0,
    "failed_timeframe_count": 0,
    "total_pairs_planned": 48,
    "pairs_completed": 0,
    "pairs_skipped": 0,
    "pairs_failed": 0,
    "selected_rows_written": 0,
    "drift_rows_written": 0,
    "transition_counts": {
      "initialize_decisions": 0,
      "unchanged_decisions": 0,
      "champion_locks": 0,
      "champion_promotions": 0
    },
    "critical_error_count": 0,
    "non_critical_error_count": 0,
    "percent_complete": 0,
    "last_heartbeat_at": null
  },
  "budgets": {
    "budget_state": "WITHIN_BUDGET",
    "max_run_seconds": 900,
    "max_timeframe_seconds": 300,
    "max_pairs_per_run": 96,
    "max_pairs_per_timeframe": 32,
    "max_in_flight_pair_evaluations": 1,
    "max_db_write_batch_size": 25,
    "max_artifact_bytes": 10485760,
    "min_cooldown_seconds": 3600,
    "lease_ttl_seconds": 120,
    "heartbeat_interval_seconds": 15,
    "exhausted_budget": null
  },
  "recommendation": {
    "decision": "HOLD",
    "reason_codes": ["UNKNOWN_STATUS"],
    "summary": "Run is queued; no terminal reoptimization recommendation is available yet."
  },
  "fail_closed_reasons": ["UNKNOWN_STATUS"],
  "artifact_manifest": null,
  "errors": []
}
